<?xml version="1.0" encoding="UTF-8"?>
<!--  Input XML document. This XML is valid against input.xsd XML schema-->

<guns:Guns xmlns:xsi="http://www.w3.org/2001/XMLSchema-instance"
        xmlns:guns="http://nure.ua/veretelnyk/GunsPractice/entity"
        xsi:schemaLocation="http://nure.ua/veretelnyk/GunsPractice/entity input.xsd">
    <Gun>
        <Model>AK-47</Model>
        <Handy>two-hand</Handy>
        <Origin>Soviet Union</Origin>

        <TTC>
            <Distance>
                <long>1500</long>
            </Distance>
            <SightingRange>800</SightingRange>
            <Collar>true</Collar>
            <Optics>false</Optics>
        </TTC>

        <Material>Metal</Material>
    </Gun>

    <Gun>
        <Model>M16</Model>
        <Handy>two-hand</Handy>
        <Origin>USA</Origin>

        <TTC>
            <Distance>
                <middle>800</middle>
            </Distance>
            <SightingRange>600</SightingRange>
            <Collar>true</Collar>
            <Optics>false</Optics>
        </TTC>

        <Material>Metal</Material>
    </Gun>

    <Gun>
        <Model>Barrett M82</Model>
        <Handy>two-hand</Handy>
        <Origin>USA</Origin>

        <TTC>
            <Distance>
                <long>2000</long>
            </Distance>
            <SightingRange>1500</SightingRange>
            <Collar>true</Collar>
            <Optics>true</Optics>
        </TTC>

        <Material>Metal</Material>
    </Gun>



</guns:Guns>